{
    "$schema": "./specops.schema.json",
    "version": 1,
    "openspec": { "command": null },
    "workflow": {
        "defaultTier": "auto",
        "onboarding": "if-missing",
        "scopeThresholds": {
            "leanMaxFiles": 2,
            "leanMaxModules": 1,
            "fullMinFiles": 9,
            "fullMinModules": 4
        }
    },
    "routing": { "forceFullForFacets": [] },
    "automation": { "requireCleanWorktree": true },
    "escalation": {
        "budgets": {
            "maxScopeEscalations": 2,
            "maxSpecialistDispatches": 8,
            "maxRepairCycles": 3,
            "maxRepeatedFailureFingerprints": 2
        }
    },
    "frontier": {
        "mode": "disabled",
        "maxEscalationsPerRun": 2,
        "maxDispatchesPerRun": 3,
        "maxHighDispatchesPerRun": 1
    },
    "questions": {
        "budgets": {
            "maxQuestionsPerRun": 4,
            "maxQuestionsPerDispatch": 3,
            "maxRepeatedQuestionFingerprints": 1
        },
        "maxPromptLength": 500,
        "maxOptionIdLength": 40,
        "maxOptionLabelLength": 120,
        "maxOtherTextLength": 1000,
        "maxMarkerBytes": 8000,
        "maxQuestionsPerMarker": 3
    },
    "review": {
        "blockingSeverities": ["BLOCKER", "HIGH"],
        "maxDiffBytes": 200000,
        "maxContextBytes": 50000,
        "transientRetries": 1,
        "agentTimeoutSeconds": 300,
        "commandTimeoutSeconds": 300,
        "commandOutputBytes": 32000
    },
    "integrations": { "mcp": "inherit" }
}
